{
  "level": "WARNING",
  "component": "automation",
  "error_code": "ALERT_THRESHOLD",
  "source": "biz",
  "code": "PH_LOW",
  "type": "threshold",
  "severity": "medium",
  "zone_id": 1,
  "node_uid": "nd-ph-1",
  "message": "pH value below threshold",
  "ts": 1737979200000,
  "details": {
    "current_value": 5.5,
    "threshold": 6.0
  }
}
